{
  "$schema": "../../schemas/auth-test-binding.schema.json",
  "schemaVersion": "1.0",
  "key": "auth.test-binding.password.establish-session",
  "name": "Password Authentication Flow Test",
  "summary": "Proves that the password authentication flow executes the real sign-in manager path, returns the normalized authentication result, and records the expected authentication log events for success and failure outcomes.",
  "version": 2,
  "maturity": "implemented",
  "testLevel": "handler-integration",
  "repository": "LagoVista/UserAdmin",
  "projectPath": "tests/LagoVista.UserAdmin.Auth.Tests",
  "sourcePath": "tests/LagoVista.UserAdmin.Auth.Tests/PasswordLoginFlowIntegrationTests.cs",
  "framework": "NUnit",
  "testTypeName": "LagoVista.UserAdmin.Auth.Tests.PasswordLoginFlowIntegrationTests",
  "testMethodNames": [
    "UserNotFound_Should_ReturnFailure_And_RecordStartedThenUserNotFound",
    "InvalidCredentials_Should_ReturnFailure_And_RecordStartedThenFailed",
    "SuccessfulLogin_Should_ReturnAuthenticated_And_RecordStartedThenSucceeded"
  ],
  "handlerKeys": ["auth.handler.password.establish-session"],
  "endpointBindingKeys": [],
  "transitionKeys": ["auth.transition.password.establish-session"],
  "proofObligations": [
    "AuthenticationFlowService delegates password authentication through PasswordLoginFlowHandler.",
    "PasswordLoginFlowHandler executes the real LagoVista SignInManager password authentication path.",
    "A missing user returns a failed normalized result and records PasswordAuthenticationStarted followed by PasswordAuthUserNotFound.",
    "Invalid credentials return a failed normalized result and record PasswordAuthenticationStarted followed by PasswordAuthenticationFailed.",
    "Successful credentials return an authenticated response and record PasswordAuthenticationStarted followed by PasswordAuthenticationSucceeded."
  ],
  "notes": [
    "Executable evidence metadata is declared with NUnit PropertyAttribute using the AptixEvidence property contract.",
    "Authentication log expectations are recorded as current observed behavior and do not yet establish a global flow logging invariant.",
    "The original delegation-only test remains useful as a narrow unit test but is no longer the primary implementation evidence for this binding."
  ],
  "sourceReferences": [
    {
      "sourceType": "test",
      "reference": "tests/LagoVista.UserAdmin.Auth.Tests/PasswordLoginFlowIntegrationTests.cs"
    },
    {
      "sourceType": "test",
      "reference": "tests/LagoVista.UserAdmin.Auth.Tests/PasswordLoginFlowTests.cs"
    }
  ]
}