{
  "$schema": "../../schemas/auth-test-binding.schema.json",
  "schemaVersion": "1.0",
  "key": "auth.test-binding.password-sign-in",
  "name": "Password Sign-In Flow Integration Proof",
  "summary": "Registers integration proof that the real authentication flow entry point, PasswordLoginFlowHandler and LagoVista SignInManager execute canonical success, rejected and locked-out password sign-in paths.",
  "version": 1,
  "maturity": "implemented",
  "testLevel": "handler-integration",
  "repository": "LagoVista/UserAdmin",
  "projectPath": "tests/LagoVista.UserAdmin.Auth.Tests",
  "sourcePath": "tests/LagoVista.UserAdmin.Auth.Tests/PasswordLoginFlowIntegrationTests.cs",
  "framework": "NUnit",
  "testTypeName": "PasswordLoginFlowIntegrationTests",
  "testMethodNames": [
    "SuccessfulLogin_Should_ReturnAuthenticated_And_RecordStartedThenSucceeded",
    "InvalidCredentials_Should_ReturnSamePublicRejection_And_RecordStartedThenFailed",
    "UserNotFound_Should_ReturnSamePublicRejection_And_RecordStartedThenUserNotFound",
    "LockedOut_Should_ReturnLockoutResult_And_RecordStartedThenFailed"
  ],
  "handlerKeys": ["auth.handler.password-sign-in"],
  "endpointBindingKeys": ["auth.endpoint.password-sign-in"],
  "transitionKeys": [
    "auth.transition.password-sign-in.success",
    "auth.transition.password-sign-in.rejected",
    "auth.transition.password-sign-in.locked-out"
  ],
  "proofObligations": [
    "real-authentication-flow-entry-point",
    "real-password-login-flow-handler",
    "real-lagovista-sign-in-manager",
    "success-transition",
    "rejected-transition-invalid-password",
    "rejected-transition-unknown-account",
    "locked-out-transition",
    "non-enumerating-public-rejection",
    "distinct-internal-auth-event-trails",
    "public-result-preserved"
  ],
  "notes": [
    "Rejected has two runtime proofs because invalid password and unknown account share one canonical public outcome while retaining distinct internal audit events.",
    "The lockout branch has its own runtime proof and canonical transition.",
    "AptixEvidence and AptixAuthEvents properties allow the test builder to emit machine-readable run evidence under .aptix/evidence."
  ],
  "sourceReferences": [
    { "sourceType": "test", "reference": "LagoVista/UserAdmin:tests/LagoVista.UserAdmin.Auth.Tests/PasswordLoginFlowIntegrationTests.cs", "note": "Canonical integration evidence source for all three Password Sign In outcomes." },
    { "sourceType": "code", "reference": "LagoVista/UserAdmin:tools/Aptix.TestEvidence/Program.cs", "note": "Extracts AptixEvidence metadata from the compiled test assembly for runtime evidence generation." }
  ]
}
